Ironie und Kömödie - ein toller Abend mit einem tollen Künstler und einem leckeren 4 - Gang-Menü in Hanstedt! https://t.co/1J8s0ZNbY2,1.0
Ironie kommt nämlich nicht gut an . Weil sie entweder zynisch erscheint . Oder aber einfach nicht verstanden wird ....oder nicht verstanden werden will . (was erschreckend häufig passiert). So oder so erregt Ihr Unmut . Also einfach mal lieber lassen . #lasttweet,1.0
"@gema_news @the_mrjt @_P4t1_ @HelgaTruepel Achso und Sarkasmus können Maschinen also auch schon erkennen, ja? Sagen Sie, aus welcher Zukunft sind Sie zurück in unsere Zeit gereist? Gibt es da schon fliegende Autos?",1.0
"@Alice_Weidel Betonkommunismus...Hübsche Wortschöpfung...(Ironie aus) Die Feinde unserer Demokratie sitzen in der AfD: Rechtsextremisten, Rechtsradikale, viele kriminelle Mitglieder und Abgeordnete! Russlandnähe, Spendenskandale! So what, Lady! Lassen Sie Ihre populistischen Empörung!",1.0
Ist ja eklig . Wer macht denn sowas? https://t.co/luvj8vSVGp,0.0
